Word,Definition,Example,Point,Category,Level
Do laundry,To wash and dry clothes,I need to do laundry before the weekend.,1,General,A1
Chore,"A routine task, especially household work",Washing dishes is my least favorite chore.,1,General,A2
Tidy,To make something clean and organized,She tidied her desk before the meeting.,1,General,A2
Take out the trash,To remove garbage from the house,Can you take out the trash tonight?,1,General,A2
First and foremost,Used to emphasize the most important point,"First and foremost, we must ensure safety.",1,Education,B2
Allowance,"A small amount of money given regularly, often to children",His parents give him a weekly allowance.,1,Economic,B1
Rest assured,To feel confident or certain about something,"Rest assured, your package will arrive on time.",1,Social,B2
Sweaty palm,"Hands that are unusually moist, usually from nervousness",He had sweaty palms before the interview.,0,Emotion,B1
Shaky voice,A voice that trembles due to nervousness or fear,Her shaky voice gave away her anxiety.,1,Emotion,B1
The mind goes blank,Forgetting everything at a moment,My mind went blank during the exam.,1,Emotion,B1
Mumble,To speak quietly and unclearly,He mumbled his answer under his breath.,1,General,A2
Fainting,Losing consciousness temporarily,She fainted from the heat.,0,Health,B1
I have got your back,To support or protect someone,"Don't worry, I've got your back.",1,Social,B1
Build rapport,To develop a friendly or trusting relationship,It's important to build rapport with clients.,0,Business,B2
Showcase your abilities,To display your skills or talents,The project gave her a chance to showcase her abilities.,1,Business,B2
Compromise,To settle a dispute by making concessions,They reached a compromise after long negotiations.,0,Social,B2
Beforehand,"Earlier, in advance",Prepare your notes beforehand for the meeting.,1,Education,B1
Enthusiasm,Strong excitement or interest,She showed great enthusiasm for the project.,1,Emotion,B1
Enthusiastic,Showing strong excitement or interest,He was enthusiastic about joining the club.,1,Emotion,B1
Do you happen to know,Polite way to ask for information,Do you happen to know where the library is?,1,Social,B2
Have honed my skills,To have improved skills through practice,I have honed my skills in public speaking over the years.,0,Education,B2
Adaptive,Able to adjust to new conditions,She is highly adaptive to changing work environments.,1,General,C1
I tend to be,Something that is usually true about oneself,I tend to be careful with my spending.,1,General,B1
Meticulous,Very careful and precise,He is meticulous about his work.,1,Education,C1
Envision,To imagine or visualize,I envision a future with more renewable energy.,0,Education,B2
Near (verb),To come close to something,The train neared the station.,1,General,B1
This is a big no,Informal: something that is definitely unacceptable,Skipping safety rules is a big no.,1,Social,B2
Stand out,To be noticeable or prominent,She stands out in a crowd because of her bright outfit.,0,Social,B1
Do a rewind,To go back and repeat something,Let's do a rewind and review the last scene.,1,Education,B2
Get to know,To become familiar with someone or something,I want to get to know my new neighbors.,1,Social,B1
Stay tuned,Keep paying attention for updates,Stay tuned for more announcements.,1,General,B1
Tenacious,Holding firmly to something; persistent and determined,She is tenacious in pursuing her goals.,0,General,C1
Do not get me wrong,Phrase used to clarify that you don't want to be misunderstood,"Don't get me wrong, I like the idea, but it needs work.",1,Social,B2
Oftentimes,Frequently; many times,"Oftentimes, people forget to back up their files.",1,General,B2
Entrepreneur,A person who starts and runs a business,The entrepreneur launched a new tech startup.,1,Business,B2
Grasp,To understand something fully,He quickly grasped the main idea of the lesson.,1,Education,B2
Concatenate,To link things together in a series or chain (often used in computing),You can concatenate two strings in Python.,1,Education,C1
Tedious,"Too long, slow, or boring; tiresome",The lecture was so tedious that students started to yawn.,0,General,B2
Clutter,A messy collection of things,The desk was full of clutter.,0,General,B2
Draw conclusion,To make a judgment after considering evidence,"From the data, we can draw the conclusion that sales are rising.",1,Education,B2
Provoke,"To cause a reaction, often anger",His rude comments provoked a fight.,0,Emotion,B2
Outage,A period when services (like power) stop working,The town experienced a power outage last night.,0,Economic,B2
Provocative,"Causing strong reaction, often deliberately",Her provocative statement sparked a debate.,0,Social,C1
Deduce,To work out something by reasoning,"From his accent, I deduced he was French.",0,Education,B2
You seem down,Expression used to say someone looks sad or unhappy,"You seem down today, is everything okay?",1,Emotion,B1
What is troubling you?,A way to ask what is bothering or worrying someone,You look worried. What is troubling you?,0,Emotion,B1
Laundry detergent,Soap or liquid used for washing clothes,I need to buy more laundry detergent from the store.,0,General,A2
Intimidating,"Making someone feel nervous, afraid, or less confident",Speaking in front of a big audience is intimidating.,0,Emotion,B2
Take the leap,To take a risk and try something new,She decided to take the leap and start her own business.,0,Business,B2
How behind I am,Expression showing how much someone has fallen behind schedule,I can't believe how behind I am on my project.,1,Education,B1
Eatery,A casual restaurant or place to eat,Let's try that new eatery downtown.,1,General,B2
Catch up,To reach the same level or update each other,I need to catch up on my reading./Let's meet and catch up.,1,Social,B1
Do not jump to conclusion,Warning not to decide too quickly without enough evidence,"Don't jump to conclusions, we don't know the full story.",0,General,B1
I am craving,Strong desire for food or something else,I am craving pizza tonight.,0,Emotion,B1
Get the hang of it,To learn how to do something after practice,"Don't worry, you'll get the hang of it soon.",0,Education,B1
Money does not grow on tree,Idiom meaning money is limited and should not be wasted,Stop spending carelessly money doesn't grow on trees.,0,Economic,B1
It slipped my mind,Expression meaning you forgot something,"Sorry, your call slipped my mind.",0,General,B1
I was in two minds,Being uncertain between two choices,I was in two minds about accepting the job offer.,0,Emotion,B2
Overdue,Late; something not done or paid by the expected time,The library book is overdue.,0,Education,B1
That food is mouth-watering,Expression meaning the food looks/smells delicious,The cake looks mouth-watering.,1,General,A2
